{"productCode":"personal-auto","effectiveDate":"2026-01-30","termMonths":12,"state":"PA","applicant":{"firstName":"Test","lastName":"User","email":"test@policy.com"},"risks":[{"type":"autoVehicle","year":2020,"make":"Honda","model":"Civic","garagingZip":"19019","usage":"commute","annualMiles":12000,"driverAge":35}],"coverages":[{"code":"PA.LIAB.BI","selected":true,"limit":100000}],"uwAnswers":{"driverAge":35}}
